{
  "$schema": "./site.schema.json",
  "version": 1,
  "meta": {
    "title": "ROBO > SOC | University Robotics Society",
    "description": "University of Nottingham Robotics Society: workshops, robotics projects and the UniBots competition, open to every student."
  },
  "brand": {
    "logo": "assets/robosoc-logo-transparent.png",
    "logoAlt": "UoN Robotics Society logo"
  },
  "navigation": {
    "calendar": "Calendar",
    "unibots": "UniBots",
    "committee": "Committee",
    "contact": "Contact",
    "join": "JOIN US!"
  },
  "links": {
    "membership": "https://su.nottingham.ac.uk/shop/product/24959-RB-1YEARmembership",
    "discord": "https://discord.gg/pT8Kv5G4Uf"
  },
  "about": {
    "heading": "Who are we?",
    "paragraphs": [
      "[[RoboSoc]] runs weekly hands-on workshops that teach you how to build a robot. Every month will cover a different aspect of the process so that by the end of the year you’ll have built a fully functioning robot."
    ],
    "bullets": [
      "WORKSHOPS: Weekly hands-on workshops ",
      "SOCIALS: Monthly socials ",
      "OPEN TO ALL: Any course, any level"
    ],
    "image": "assets/electronics-workshop-640.webp",
    "imagePosition": "50% 50%",
    "imageAlt": "Students learning breadboard electronics at a RoboSoc workshop"
  },
  "calendar": {
    "heading": "What's on?"
  },
  "competition": {
    "heading": "Build. Learn. Compete.",
    "body": "Join a team to compete in the UniBots competition. No experience is needed since all our workshops will prepare you and your team to compete by the end of the year.",
    "points": [
      {
        "label": "SKILLS_TAUGHT",
        "text": "Arduino, CAD, coding, electronics and mechanical engineering."
      },
      {
        "label": "KIT_INCLUDED",
        "text": "Tools, parts and resources for your build."
      },
      {
        "label": "TEAM_SUPPORT",
        "text": "Weekly workshops, year-long curriculum, lively community."
      }
    ],
    "image": "assets/workshop-event-640.webp",
    "imagePosition": "50% 50%",
    "imageAlt": "RoboSoc workshop with students learning robotics together"
  },
  "committee": {
    "heading": "Committee",
    "scrollHint": "SCROLL TO EXPLORE"
  },
  "footer": {
    "contactTitle": "CONTACT",
    "contact": [
      {
        "icon": "fa-solid fa-graduation-cap",
        "text": "University of Nottingham"
      },
      {
        "icon": "fa-solid fa-message",
        "text": "Message us on Discord or Instagram"
      }
    ],
    "linksTitle": "LINKS",
    "links": [
      {
        "icon": "fa-brands fa-discord",
        "label": "Discord Server",
        "url": "https://discord.gg/pT8Kv5G4Uf"
      },
      {
        "icon": "fa-brands fa-instagram",
        "label": "Instagram",
        "url": "https://www.instagram.com/uon_robotics_society/"
      },
      {
        "icon": "fa-solid fa-id-card",
        "label": "Buy Membership",
        "url": "https://su.nottingham.ac.uk/shop/product/24959-RB-1YEARmembership"
      }
    ],
    "copyright": "© 2026 ROBO>SOC • UoN Robotics Society"
  }
}
